ID,group,group_high,group_low,site,author_year,title,study_design,sample size,n_high,n_low,n_pre,n_post,outcome_assessment,m_pre,m_post,m_change,md,m_high,m_low,md_high_low,sd_high,sd_low,t,df,cohen d,sd_pre,sd_post,sd_change,pooled_sd,standard_error,lower_ci,upper_ci,smd_effctsize,author,Name,significant,significant direction,direction description,Delete,Country.of.Expirement,Size..n.,Industry.of.Participant,Gender,Nature.Type,Real.Exposure.Type,Exposure.Time..Mins.,Before_COVID,During_COVID,After_COVID,Field,Lab,Survey,Interviews,Stimuli_Visual,Stimuli_Auditory,Stimuli_Tactile,Stimuli_Olfactory,Stimuli_Thermal,Subjective,Objective,Row_ID,dep_var_1,dep_var_2,dep_var_3,dep_var_4,dep_var_5,dep_var_6,dep_var_7,dep_var_8,dep_var_9,assmnt_1,assmnt_2,assmnt_3,assmnt_4,assmnt_5,assmnt_6,assmnt_7,assmnt_8,assmnt_9,phys_assmnt_1,phys_assmnt_2,phys_assmnt_3,phys_assmnt_4,phys_assmnt_5,phys_assmnt_6,phys_assmnt_7,phys_assmnt_8,phys_assmnt_9,Column1,Column2,Column3,Column4,Column5
5,NA,NA,NA,NA,Bianchi et al. (2024),Exploring the Connections Between Nature Exposure and Stress During COVID-19 Using Latent Profile Analysis,Pre-post (Within-subject),NA,NA,NA,419,262,Perceived Stress Scale (PSS-10),17,16,-1,NA,NA,NA,NA,NA,NA,NA,NA,NA,7.7,7.5,7.600657866,7.600657866,0.469570211,-1.920357614,-0.079642386,-0.131567559,Bianchi et al. (2024),Exploring the Connections Between Nature Exposure and Stress During COVID-19 Using Latent Profile Analysis,NA,NA,NA,NA,United States,603,NA,Mixed,NA,NA,0,0,1,0,0,0,1,0,NA,NA,NA,NA,NA,1,0,42,Stress,Nature Exposure,NA,NA,NA,NA,NA,NA,NA,Perceived Stress Scale (PSS-10),Self-reported indoor and outdoor nature exposure survey,NA,NA,NA,NA,NA,NA,NA,NA,NA,NA,NA,NA,NA,NA,NA,NA,NA,NA,NA,NA,NA
5,NA,NA,NA,NA,Bianchi et al. (2024),Exploring the Connections Between Nature Exposure and Stress During COVID-19 Using Latent Profile Analysis,Pre-post (Follow-up),NA,NA,NA,419,155,Perceived Stress Scale (PSS-10),17,16,-1,NA,NA,NA,NA,NA,NA,NA,NA,NA,7.7,8.8,8.268313008,8.268313008,0.664126883,-2.30168869,0.30168869,-0.120943655,Bianchi et al. (2024),Exploring the Connections Between Nature Exposure and Stress During COVID-19 Using Latent Profile Analysis,NA,NA,NA,NA,United States,603,NA,Mixed,NA,NA,0,0,1,0,0,0,1,0,NA,NA,NA,NA,NA,1,0,42,Stress,Nature Exposure,NA,NA,NA,NA,NA,NA,NA,Perceived Stress Scale (PSS-10),Self-reported indoor and outdoor nature exposure survey,NA,NA,NA,NA,NA,NA,NA,NA,NA,NA,NA,NA,NA,NA,NA,NA,NA,NA,NA,NA,NA
20,NA,NA,NA,NA,Elsadek et al. (2024),"High-rise window views: Evaluating the physiological and psychological impacts of green, blue, and built environments",Pre-post (within-subjects),45,NA,NA,NA,NA,"Skin Conductance (SC, μS)",3.09,1.65,-1.44,NA,NA,NA,NA,NA,NA,NA,NA,NA,0.15,0.09,0.123693169,NA,0.018439089,-1.476140614,-1.403859386,-11.64171,Elsadek et al. (2024),"High-rise window views: Evaluating the physiological and psychological impacts of green, blue, and built environments",yes,negative,"Reduced stress and anxiety, especially for green and blue views",NA,China,45,Academia,Mixed,Artificial/Virtual,Indirect,4,0,0,1,0,1,0,0,1,0,0,0,0,0,1,52,Anxiety,Relaxation and Comfort,Brain Activity (Alpha Waves),Heart Rate Variability (HRV),Skin Conductance (SC),Skin Temperature (ST),NA,NA,NA,State-Trait Anxiety Inventory (STAI),Modified Semantic Differential (SD) Questionnaire,NA,NA,NA,NA,NA,NA,NA,NA,NA,Electroencephalography (EEG),Photoplethysmography (PPG),Electrodermal Activity (EDA) Sensor,Skin Temperature Sensor,NA,NA,NA,NA,NA,NA,NA,NA
20,NA,green + water,control,NA,Elsadek et al. (2024),"High-rise window views: Evaluating physiological and psychological impacts of green, blue, and built environments",Between-groups (GW vs Control),NA,45,45,NA,NA,EEG Alpha relative power (O1),NA,NA,NA,NA,0.23,0.14,0.09,0.02,0.03,NA,NA,NA,NA,NA,NA,0.025495098,0.005374838,0.079465317,0.100534683,3.530090432,Elsadek et al. (2024),"High-rise window views: Evaluating the physiological and psychological impacts of green, blue, and built environments",yes,negative,"Reduced stress and anxiety, especially for green and blue views",NA,China,45,Academia,Mixed,Artificial/Virtual,Indirect,4,0,0,1,0,1,0,0,1,0,0,0,0,0,1,52,Anxiety,Relaxation and Comfort,Brain Activity (Alpha Waves),Heart Rate Variability (HRV),Skin Conductance (SC),Skin Temperature (ST),NA,NA,NA,State-Trait Anxiety Inventory (STAI),Modified Semantic Differential (SD) Questionnaire,NA,NA,NA,NA,NA,NA,NA,NA,NA,Electroencephalography (EEG),Photoplethysmography (PPG),Electrodermal Activity (EDA) Sensor,Skin Temperature Sensor,NA,NA,NA,NA,NA,NA,NA,NA
21,NA,tropical,control,NA,Fukumoto et al. (2024),The effects of different designs of indoor biophilic greening on psychological and physiological responses and cognitive performance of office workers,Between-groups (Tropical vs. Control),NA,18,18,NA,NA,EEG Alpha wave power (ROI-4),NA,NA,NA,NA,36.39,37.98,-1.59,3.68,4.81,NA,NA,NA,NA,NA,NA,4.282435055,1.427478352,-4.387857569,1.207857569,-0.371284089,Fukumoto et al. (2024),The effects of different designs of indoor biophilic greening on psychological and physiological responses and cognitive performance of office workers,yes,positive,"Japanese design reduced negative affect, while tropical design promoted positive mood states",NA,Japan,18,Office worker,Mixed,Real,Direct,5,0,0,1,0,1,0,0,1,0,0,0,0,1,0,107,Positive and Negative Affect (PANAS),Cognitive Performance,Brain Activity (EEG),NA,NA,NA,NA,NA,NA,Positive and Negative Affect Schedule (PANAS),"Stroop Task, 1-Back, and 2-Back Tasks",NA,NA,NA,NA,NA,NA,NA,NA,NA,Electroencephalogram (EEG),NA,NA,NA,NA,NA,NA,NA,NA,NA,NA,NA
24,NA,Gardening task,mental task (control),NA,Hassan & Deshun (2023),Promoting adult health: the neurophysiological benefits of watering plants and engaging in mental tasks within designed environments,Between-groups (Gardening vs. Mental),NA,25,25,NA,NA,EEG Alpha wave power,NA,NA,NA,NA,28326.92,23618.74,4708.18,2956.05,2501.16,NA,NA,NA,NA,NA,NA,2738.068019,774.4425853,3190.272533,6226.087467,1.719526311,Hassan and Deshun (2023),Promoting adult health: the neurophysiological benefits of watering plants and engaging in mental tasks within designed environments,yes,positive,increased relaxation and cognitive focus,NA,China,50,NA,NA,Real,Direct,15,0,0,1,0,0,0,0,1,0,1,0,0,1,1,48,Brain Activity (Alpha/Beta Waves),Blood Pressure,Anxiety,NA,NA,NA,NA,NA,NA,NA,NA,State-Trait Anxiety Inventory (STAI),NA,NA,NA,NA,NA,NA,Electroencephalography (EEG),Blood Pressure Measurement (Omron HEM-7011),NA,NA,NA,NA,NA,NA,NA,NA,NA,NA,NA,NA
25,NA,NA,NA,NA,Heilmayr & Miller (2021),"Nature Exposure Achieves Comparable Health and Well-Being Improvements as Best Practice, Positive Psychology Interventions",Pre-post (Within-subjects),37,NA,NA,NA,NA,Perceived Stress Scale (PSS-14),2.7,2.55,-0.15,NA,NA,NA,NA,NA,NA,NA,NA,NA,0.61,0.48,0.44,0.54886246,0.072335554,-0.291777687,-0.008222313,-0.273292511,Heilmayr and Miller (2021),"Nature Exposure Achieves Comparable Health and Well-Being Improvements as Best Practice, Positive Psychology Interventions",yes,positive,improved,NA,United States,104,Academia,"Mostly Female (75%+)
",Real,Direct,120,0,1,0,1,0,1,0,1,0,0,0,0,1,0,50,Physical Health Composite,Well-Being Composite,Stress,Fatigue Composite,Nature Identity Composite,NA,NA,NA,NA,Short Form-36 Health Survey (SF-36),"Comprehensive Inventory of Thriving (CIT), Satisfaction with Life Scale (SWLS)",Perceived Stress Scale (PSS-14),"PROMIS Fatigue Scale, SF-36 Energy Subscale","Environmental Identity Scale, Connectedness to Nature Scale",NA,NA,NA,NA,NA,NA,NA,NA,NA,NA,NA,NA,NA,NA,NA,NA,NA,NA
37,NA,forest,plaza,NA,Jin et al. (2022),Attention and Emotion Recovery Effects of Urban Parks during COVID-19—Psychological Symptoms as Moderators,Between-groups (cross-sectional),NA,25,25,NA,NA,Perceived Stress Scale (PSS-10),NA,NA,NA,NA,13.16,12.84,0.32,5.16,5.39,NA,NA,NA,NA,NA,NA,5.276253406,1.492349825,-2.605005657,3.245005657,0.060649096,Jin et al. (2022),Attention and Emotion Recovery Effects of Urban Parks during COVID-19—Psychological Symptoms as Moderators,yes,positive,improvement,NA,China,125,Academia,Mixed,Artificial/Virtual,NA,10,0,1,0,0,1,0,0,1,1,0,0,0,1,1,11,Attention Function,Emotional response,Emotional Arousal,Stress Symptoms,Depressive Symptoms,NA,NA,NA,NA,Backward Digit Span Task (BDS),Emotional Valence,Self-Assessment Manikin Scale (SAM),Perceived Stress Scale (PSS-10),Patient Health Questionnaire (PHQ-9),NA,NA,NA,NA,NA,NA,NA,NA,NA,NA,NA,NA,NA,NA,NA,NA,NA,NA
37,NA,waterside,plaza,NA,Jin et al. (2022),Attention and Emotion Recovery Effects of Urban Parks during COVID-19—Psychological Symptoms as Moderators,Between-groups (cross-sectional),NA,25,25,NA,NA,Perceived Stress Scale (PSS-10),NA,NA,NA,NA,13.48,12.84,0.64,4.1,5.39,NA,NA,NA,NA,NA,NA,4.788637593,1.354431246,-2.014685242,3.294685242,0.133649705,Jin et al. (2022),Attention and Emotion Recovery Effects of Urban Parks during COVID-19—Psychological Symptoms as Moderators,yes,positive,improvement,NA,China,125,Academia,Mixed,Artificial/Virtual,NA,10,0,1,0,0,1,0,0,1,1,0,0,0,1,1,11,Attention Function,Emotional response,Emotional Arousal,Stress Symptoms,Depressive Symptoms,NA,NA,NA,NA,Backward Digit Span Task (BDS),Emotional Valence,Self-Assessment Manikin Scale (SAM),Perceived Stress Scale (PSS-10),Patient Health Questionnaire (PHQ-9),NA,NA,NA,NA,NA,NA,NA,NA,NA,NA,NA,NA,NA,NA,NA,NA,NA,NA
37,NA,lawn,plaza,NA,Jin et al. (2022),Attention and Emotion Recovery Effects of Urban Parks during COVID-19—Psychological Symptoms as Moderators,Between-groups (cross-sectional),NA,25,25,NA,NA,Perceived Stress Scale (PSS-10),NA,NA,NA,NA,14.28,12.84,1.44,4.97,5.39,NA,NA,NA,NA,NA,NA,5.184255009,1.466328749,-1.434004348,4.314004348,0.277764114,Jin et al. (2022),Attention and Emotion Recovery Effects of Urban Parks during COVID-19—Psychological Symptoms as Moderators,yes,positive,improvement,NA,China,125,Academia,Mixed,Artificial/Virtual,NA,10,0,1,0,0,1,0,0,1,1,0,0,0,1,1,11,Attention Function,Emotional response,Emotional Arousal,Stress Symptoms,Depressive Symptoms,NA,NA,NA,NA,Backward Digit Span Task (BDS),Emotional Valence,Self-Assessment Manikin Scale (SAM),Perceived Stress Scale (PSS-10),Patient Health Questionnaire (PHQ-9),NA,NA,NA,NA,NA,NA,NA,NA,NA,NA,NA,NA,NA,NA,NA,NA,NA,NA
37,NA,green street,plaza,NA,Jin et al. (2022),Attention and Emotion Recovery Effects of Urban Parks during COVID-19—Psychological Symptoms as Moderators,Between-groups (cross-sectional),NA,25,25,NA,NA,Perceived Stress Scale (PSS-10),NA,NA,NA,NA,13.96,12.84,1.12,5.57,5.39,NA,NA,NA,NA,NA,NA,5.480739001,1.550187085,-1.918366688,4.158366688,0.204352004,Jin et al. (2022),Attention and Emotion Recovery Effects of Urban Parks during COVID-19—Psychological Symptoms as Moderators,yes,positive,improvement,NA,China,125,Academia,Mixed,Artificial/Virtual,NA,10,0,1,0,0,1,0,0,1,1,0,0,0,1,1,11,Attention Function,Emotional response,Emotional Arousal,Stress Symptoms,Depressive Symptoms,NA,NA,NA,NA,Backward Digit Span Task (BDS),Emotional Valence,Self-Assessment Manikin Scale (SAM),Perceived Stress Scale (PSS-10),Patient Health Questionnaire (PHQ-9),NA,NA,NA,NA,NA,NA,NA,NA,NA,NA,NA,NA,NA,NA,NA,NA,NA,NA
42,NA,NA,NA,NA,Koivisto et al. (2024),A short simulated nature experience as an effective way to promote restoration from work-related stress,Pre-post (within-subjects),29,NA,NA,NA,NA,Skin Conductance Response (SCR),21.97,15.38,-6.59,NA,NA,NA,NA,NA,NA,NA,NA,NA,15.94,16.01,15.97503834,NA,2.966490147,-12.40432069,-0.775679312,-0.412518572,Koivisto et al. (2024),A short simulated nature experience as an effective way to promote restoration from work-related stress,yes,positive,increased,NA,Finland,30,Academia,Mixed,Artificial/Virtual,Indirect,5,0,1,1,0,1,0,0,1,0,0,0,0,1,1,3,Subjective Restoration,Emotional Arousal,Relaxation,Nature Connectedness,NA,NA,NA,NA,NA,Restoration Outcome Scale (ROS),NA,NA,Extended Inclusion of Nature in Self (EINS),NA,NA,NA,NA,NA,NA,Electrodermal Activity (EDA),Electroencephalography (EEG),NA,NA,NA,NA,NA,NA,NA,NA,NA,NA,NA
42,NA,nature condition,control condition,NA,Koivisto et al. (2024),A short simulated nature experience as an effective way to promote restoration from work-related stress,Within-subject (Nature vs Control),26,NA,NA,NA,NA,EEG Lower Alpha (8–10 Hz),3.37,4.13,0.76,NA,NA,NA,NA,NA,NA,NA,NA,NA,1.18,1.97,1.623776462,NA,0.318448764,0.135840422,1.384159578,0.46804472,Koivisto et al. (2024),A short simulated nature experience as an effective way to promote restoration from work-related stress,yes,positive,increased,NA,Finland,30,Academia,Mixed,Artificial/Virtual,Indirect,5,0,1,1,0,1,0,0,1,0,0,0,0,1,1,3,Subjective Restoration,Emotional Arousal,Relaxation,Nature Connectedness,NA,NA,NA,NA,NA,Restoration Outcome Scale (ROS),NA,NA,Extended Inclusion of Nature in Self (EINS),NA,NA,NA,NA,NA,NA,Electrodermal Activity (EDA),Electroencephalography (EEG),NA,NA,NA,NA,NA,NA,NA,NA,NA,NA,NA
48,NA,NA,NA,NA,Lei et al. (2021),A quantitative study for indoor workplace biophilic design to improve health and productivity performance,Pre-post (within-subjects),15,NA,NA,NA,NA,"Skin Conductance Level (SCL, μS)",13.63,5.38,-8.25,NA,NA,NA,NA,NA,NA,NA,NA,NA,8.28,4.86,6.78888798,NA,1.752883339,-11.68565134,-4.814348656,-1.215221112,Lei et al. (2021),A quantitative study for indoor workplace biophilic design to improve health and productivity performance,no,NA,NA,NA,"Singapore, Hong Kong",15,Office worker,Mixed,Both,Both,5,0,0,0,0,1,0,0,1,0,0,0,0,1,1,2,Stress,Relaxation,Arousal,Perceived Restorativeness,Reaction Speed,Attention,Working Memory,NA,NA,NA,NA,NA,Perceived Restorativeness Scale (PRS),Visual Reaction Time Task (VRTT),Stroop Test,Working Memory Task,NA,NA,Heart Rate Variability (HRV),Electroencephalogram (EEG),Electrodermal Activity (EDA),NA,NA,NA,NA,NA,NA,NA,NA,NA,NA,NA
48,NA,NA,NA,NA,Lei et al. (2021),A quantitative study for indoor workplace biophilic design to improve health and productivity performance,Pre-post (within-subjects),15,NA,NA,NA,NA,"EEG Alpha wave (Total power, dB)",49.6,77.94,28.34,NA,NA,NA,NA,NA,NA,NA,NA,NA,24.62,23.98,24.3021069,NA,6.274777021,16.04143704,40.63856296,1.166154034,Lei et al. (2021),A quantitative study for indoor workplace biophilic design to improve health and productivity performance,no,NA,NA,NA,"Singapore, Hong Kong",15,Office worker,Mixed,Both,Both,5,0,0,0,0,1,0,0,1,0,0,0,0,1,1,2,Stress,Relaxation,Arousal,Perceived Restorativeness,Reaction Speed,Attention,Working Memory,NA,NA,NA,NA,NA,Perceived Restorativeness Scale (PRS),Visual Reaction Time Task (VRTT),Stroop Test,Working Memory Task,NA,NA,Heart Rate Variability (HRV),Electroencephalogram (EEG),Electrodermal Activity (EDA),NA,NA,NA,NA,NA,NA,NA,NA,NA,NA,NA
55,"Urban residential (Rio de Janeiro, Brazil)",NA,NA,Home Gardens (private residential gardens),Marques et al. (2021),Home gardens can be more important than other urban green infrastructure for mental well-being during COVID-19 pandemics,between groups,173,NA,NA,NA,NA,"Depression, Anxiety, and Stress Scale (DASS-21)",NA,NA,NA,-10.997,NA,NA,NA,NA,NA,-2.791116751,171,-0.426884065,NA,NA,NA,NA,3.94,-18.7194,-39.48114075,-0.426884065,Marques et al. (2021),Home gardens can be more important than other urban green infrastructure for mental well-being during COVID-19 pandemics,NA,NA,NA,NA,Brazil,173,NA,"Mostly Female (75%+)
",NA,NA,0,0,1,0,0,0,1,0,NA,NA,NA,NA,NA,1,0,55,Mental Distress,Green Infrastructure Exposure,NA,NA,NA,NA,NA,NA,NA,Depression Anxiety Stress Scale (DASS-21),Self-reported interaction with urban green infrastructure survey,NA,NA,NA,NA,NA,NA,NA,NA,NA,NA,NA,NA,NA,NA,NA,NA,NA,NA,NA,NA,NA
69,Nature-Exercise Group,NA,NA,NA,Rajoo et al. (2021),Addressing psychosocial issues caused by the COVID-19 lockdown: Can urban greeneries help?,Pre-post (within-group),15,NA,NA,NA,NA,"Depression, Anxiety, and Stress Scale (DASS-21)",13.13,11.27,-1.86,NA,NA,NA,NA,NA,NA,NA,NA,NA,3.96,4.41,4.191044023,NA,1.082122914,-3.980960911,0.260960911,-0.443803499,Rajoo et al. (2021),Addressing psychosocial issues caused by the COVID-19 lockdown: Can urban greeneries help?,yes,negative,reduction,NA,Malaysia,30,NA,Mixed,Real,Direct,20,0,1,0,1,0,0,0,1,1,1,0,0,1,0,7,Stress,Anxiety,Depression,NA,NA,NA,NA,NA,NA,Depression Anxiety Stress Scale (DASS-21),Depression Anxiety Stress Scale (DASS-21),Depression Anxiety Stress Scale (DASS-21),NA,NA,NA,NA,NA,NA,NA,NA,NA,NA,NA,NA,NA,NA,NA,NA,NA,NA,NA,NA
69,Nature Therapy Group,NA,NA,NA,Rajoo et al. (2021),Addressing psychosocial issues caused by the COVID-19 lockdown: Can urban greeneries help?,Pre-post (within-group),15,NA,NA,NA,NA,"Depression, Anxiety, and Stress Scale (DASS-21)",12.13,7.67,-4.46,NA,NA,NA,NA,NA,NA,NA,NA,NA,5.11,3.48,4.371641568,NA,1.128752999,-6.672355879,-2.247644121,-1.020211728,Rajoo et al. (2021),Addressing psychosocial issues caused by the COVID-19 lockdown: Can urban greeneries help?,yes,negative,reduction,NA,Malaysia,30,NA,Mixed,Real,Direct,20,0,1,0,1,0,0,0,1,1,1,0,0,1,0,7,Stress,Anxiety,Depression,NA,NA,NA,NA,NA,NA,Depression Anxiety Stress Scale (DASS-21),Depression Anxiety Stress Scale (DASS-21),Depression Anxiety Stress Scale (DASS-21),NA,NA,NA,NA,NA,NA,NA,NA,NA,NA,NA,NA,NA,NA,NA,NA,NA,NA,NA,NA
98,"High Stress, High Deprivation",High (65.8%) green space,Low (49.5%) Green Space,"c3 (high exposure), c4 (low exposure)",Ward Thompson (2016),Mitigating Stress and Supporting Health in Deprived Urban Communities: The Importance of Green Space and the Social Environment,between groups,NA,99,106,NA,NA,Perceived Stress Scale (PSS),NA,NA,NA,NA,13.2,14,NA,6.8,5.2,NA,NA,NA,1.9,NA,NA,6.025692119,0.849802946,-2.465613774,0.865613774,-0.132764832,Ward Thompson et al. (2016),Mitigating Stress and Supporting Health in Deprived Urban Communities: The Importance of Green Space and the Social Environment,NA,NA,NA,NA,"United Kingdom, Scotland",406,NA,Mixed,NA,Indirect,0,1,0,0,0,0,1,0,NA,NA,NA,NA,NA,1,1,118,Stress,Mental Wellbeing,NA,NA,NA,NA,NA,NA,NA,Perceived Stress Scale (PSS),Shorter Warwick-Edinburgh Mental Wellbeing Scale (SWEMWBS),NA,NA,NA,NA,NA,NA,NA,NA,NA,NA,NA,NA,NA,NA,NA,NA,NA,NA,NA,NA,NA
100,Grassland Slopes,NA,NA,s1,Weng et al. (2024),Quantitative Analysis of Physiological and Psychological Impacts of Visual and Auditory Elements in Wuyishan National Park Using Eye-Tracking,Pre-Post (Within-Subjects),41,NA,NA,NA,NA,Total Mood Disturbance (TMD),NA,NA,-0.24,NA,NA,NA,NA,NA,NA,NA,NA,NA,NA,NA,6.14,NA,0.958906898,-2.11945752,1.63945752,-0.039087948,Weng et al. (2024),Quantitative Analysis of Physiological and Psychological Impacts of Visual and Auditory Elements in Wuyishan National Park Using Eye-Tracking,yes,positive,NA,NA,China,41,NA,Mixed,Real,Direct,15,0,0,1,1,0,0,0,1,1,0,0,0,1,1,90,Mood States,Positive and Negative Affect,NA,NA,NA,NA,NA,NA,NA,Profile of Mood States (POMS),Positive and Negative Affect Schedule (PANAS),NA,NA,NA,NA,NA,NA,NA,NA,NA,NA,NA,NA,NA,NA,NA,NA,NA,NA,NA,NA,NA
100,Broadleaf Forest Valley,NA,NA,s2,Weng et al. (2024),Quantitative Analysis of Physiological and Psychological Impacts of Visual and Auditory Elements in Wuyishan National Park Using Eye-Tracking,Pre-Post (Within-Subjects),41,NA,NA,NA,NA,Total Mood Disturbance (TMD),NA,NA,0.29,NA,NA,NA,NA,NA,NA,NA,NA,NA,NA,NA,6.23,NA,0.972962537,-1.617006572,2.197006572,0.046548957,Weng et al. (2024),Quantitative Analysis of Physiological and Psychological Impacts of Visual and Auditory Elements in Wuyishan National Park Using Eye-Tracking,yes,positive,NA,NA,China,41,NA,Mixed,Real,Direct,15,0,0,1,1,0,0,0,1,1,0,0,0,1,1,90,Mood States,Positive and Negative Affect,NA,NA,NA,NA,NA,NA,NA,Profile of Mood States (POMS),Positive and Negative Affect Schedule (PANAS),NA,NA,NA,NA,NA,NA,NA,NA,NA,NA,NA,NA,NA,NA,NA,NA,NA,NA,NA,NA,NA
100,Mixed Broadleaf and Coniferous Forest Valley,NA,NA,s3,Weng et al. (2024),Quantitative Analysis of Physiological and Psychological Impacts of Visual and Auditory Elements in Wuyishan National Park Using Eye-Tracking,Pre-Post (Within-Subjects),41,NA,NA,NA,NA,Total Mood Disturbance (TMD),NA,NA,-3.1,NA,NA,NA,NA,NA,NA,NA,NA,NA,NA,NA,5.26,NA,0.821473988,-4.710089016,-1.489910984,-0.589353612,Weng et al. (2024),Quantitative Analysis of Physiological and Psychological Impacts of Visual and Auditory Elements in Wuyishan National Park Using Eye-Tracking,yes,positive,NA,NA,China,41,NA,Mixed,Real,Direct,15,0,0,1,1,0,0,0,1,1,0,0,0,1,1,90,Mood States,Positive and Negative Affect,NA,NA,NA,NA,NA,NA,NA,Profile of Mood States (POMS),Positive and Negative Affect Schedule (PANAS),NA,NA,NA,NA,NA,NA,NA,NA,NA,NA,NA,NA,NA,NA,NA,NA,NA,NA,NA,NA,NA
100,Broadleaf Ridge Forest,NA,NA,s4,Weng et al. (2024),Quantitative Analysis of Physiological and Psychological Impacts of Visual and Auditory Elements in Wuyishan National Park Using Eye-Tracking,Pre-Post (Within-Subjects),41,NA,NA,NA,NA,Total Mood Disturbance (TMD),NA,NA,-2.98,NA,NA,NA,NA,NA,NA,NA,NA,NA,NA,NA,4.59,NA,0.716837567,-4.385001631,-1.574998369,-0.649237473,Weng et al. (2024),Quantitative Analysis of Physiological and Psychological Impacts of Visual and Auditory Elements in Wuyishan National Park Using Eye-Tracking,yes,positive,NA,NA,China,41,NA,Mixed,Real,Direct,15,0,0,1,1,0,0,0,1,1,0,0,0,1,1,90,Mood States,Positive and Negative Affect,NA,NA,NA,NA,NA,NA,NA,Profile of Mood States (POMS),Positive and Negative Affect Schedule (PANAS),NA,NA,NA,NA,NA,NA,NA,NA,NA,NA,NA,NA,NA,NA,NA,NA,NA,NA,NA,NA,NA
100,Mixed Broadleaf and Coniferous Forest Slopes,NA,NA,s5,Weng et al. (2024),Quantitative Analysis of Physiological and Psychological Impacts of Visual and Auditory Elements in Wuyishan National Park Using Eye-Tracking,Pre-Post (Within-Subjects),41,NA,NA,NA,NA,Total Mood Disturbance (TMD),NA,NA,-1,NA,NA,NA,NA,NA,NA,NA,NA,NA,NA,NA,6.14,NA,0.958906898,-2.87945752,0.87945752,-0.16286645,Weng et al. (2024),Quantitative Analysis of Physiological and Psychological Impacts of Visual and Auditory Elements in Wuyishan National Park Using Eye-Tracking,yes,positive,NA,NA,China,41,NA,Mixed,Real,Direct,15,0,0,1,1,0,0,0,1,1,0,0,0,1,1,90,Mood States,Positive and Negative Affect,NA,NA,NA,NA,NA,NA,NA,Profile of Mood States (POMS),Positive and Negative Affect Schedule (PANAS),NA,NA,NA,NA,NA,NA,NA,NA,NA,NA,NA,NA,NA,NA,NA,NA,NA,NA,NA,NA,NA
100,Tea Gardens of the Valley,NA,NA,s6,Weng et al. (2024),Quantitative Analysis of Physiological and Psychological Impacts of Visual and Auditory Elements in Wuyishan National Park Using Eye-Tracking,Pre-Post (Within-Subjects),41,NA,NA,NA,NA,Total Mood Disturbance (TMD),NA,NA,-2.5,NA,NA,NA,NA,NA,NA,NA,NA,NA,NA,NA,5.6,NA,0.874573067,-4.21416321,-0.78583679,-0.446428571,Weng et al. (2024),Quantitative Analysis of Physiological and Psychological Impacts of Visual and Auditory Elements in Wuyishan National Park Using Eye-Tracking,yes,positive,NA,NA,China,41,NA,Mixed,Real,Direct,15,0,0,1,1,0,0,0,1,1,0,0,0,1,1,90,Mood States,Positive and Negative Affect,NA,NA,NA,NA,NA,NA,NA,Profile of Mood States (POMS),Positive and Negative Affect Schedule (PANAS),NA,NA,NA,NA,NA,NA,NA,NA,NA,NA,NA,NA,NA,NA,NA,NA,NA,NA,NA,NA,NA
100,Broadleaf Forest Streamside,NA,NA,s7,Weng et al. (2024),Quantitative Analysis of Physiological and Psychological Impacts of Visual and Auditory Elements in Wuyishan National Park Using Eye-Tracking,Pre-Post (Within-Subjects),41,NA,NA,NA,NA,Total Mood Disturbance (TMD),NA,NA,-3.32,NA,NA,NA,NA,NA,NA,NA,NA,NA,NA,NA,5.45,NA,0.851147002,-4.988248124,-1.651751876,-0.609174312,Weng et al. (2024),Quantitative Analysis of Physiological and Psychological Impacts of Visual and Auditory Elements in Wuyishan National Park Using Eye-Tracking,yes,positive,NA,NA,China,41,NA,Mixed,Real,Direct,15,0,0,1,1,0,0,0,1,1,0,0,0,1,1,90,Mood States,Positive and Negative Affect,NA,NA,NA,NA,NA,NA,NA,Profile of Mood States (POMS),Positive and Negative Affect Schedule (PANAS),NA,NA,NA,NA,NA,NA,NA,NA,NA,NA,NA,NA,NA,NA,NA,NA,NA,NA,NA,NA,NA
100,Rock-Bedded Streamscape,NA,NA,s8,Weng et al. (2024),Quantitative Analysis of Physiological and Psychological Impacts of Visual and Auditory Elements in Wuyishan National Park Using Eye-Tracking,Pre-Post (Within-Subjects),41,NA,NA,NA,NA,Total Mood Disturbance (TMD),NA,NA,-4.2,NA,NA,NA,NA,NA,NA,NA,NA,NA,NA,NA,4.51,NA,0.704343666,-5.580513586,-2.819486414,-0.931263858,Weng et al. (2024),Quantitative Analysis of Physiological and Psychological Impacts of Visual and Auditory Elements in Wuyishan National Park Using Eye-Tracking,yes,positive,NA,NA,China,41,NA,Mixed,Real,Direct,15,0,0,1,1,0,0,0,1,1,0,0,0,1,1,90,Mood States,Positive and Negative Affect,NA,NA,NA,NA,NA,NA,NA,Profile of Mood States (POMS),Positive and Negative Affect Schedule (PANAS),NA,NA,NA,NA,NA,NA,NA,NA,NA,NA,NA,NA,NA,NA,NA,NA,NA,NA,NA,NA,NA
102,NA,NA,NA,NA,Wood et al. (2016),A Case–Control Study of the Health and Well-being Benefits of Allotment Gardening,Pre-Post,136,NA,NA,NA,NA,Total Mood Disturbance (TMD),143.6,138.7,4.9,NA,NA,NA,NA,NA,NA,NA,NA,NA,16.9,15.1,16.07575815,NA,1.378484889,2.198169618,7.601830382,0.304806775,Wood et al. (2016),A case-control study of the health and well-being benefits of allotment gardening,yes,positive,increase,NA,United Kingdom,269,NA,Mixed,Real,Direct,156,1,0,0,1,0,0,0,1,0,1,1,0,1,0,1,Self-esteem,Mood,General Health,NA,NA,NA,NA,NA,NA,Rosenberg Self-Esteem Scale,Profile of Mood States (POMS),General Health Questionnaire (GHQ-12),NA,NA,NA,NA,NA,NA,NA,NA,NA,NA,NA,NA,NA,NA,NA,NA,NA,NA,NA,NA
